{
  "meta": {
    "language": "zh",
    "theme": "classic"
  },
  "basics": {
    "name": "张三",
    "english_name": "Zhang San",
    "label": "前端工程师 · 应届生",
    "gender": "男",
    "birth": "2003-05",
    "phone": "138 xxxx 8888",
    "email": "zhangsan@example.com",
    "location": "北京",
    "website": "https://example.com",
    "profiles": [
      {
        "network": "GitHub",
        "username": "zhangsan",
        "url": "https://github.com/zhangsan"
      },
      {
        "network": "LinkedIn",
        "username": "zhangsan",
        "url": "https://linkedin.com/in/zhangsan"
      }
    ],
    "summary": "计算机科学本科应届生，两段一线互联网前端实习经历，熟悉 React / TypeScript 与工程化。追求\"能落地、有度量\"的工程实践。"
  },
  "education": [
    {
      "institution": "某某大学",
      "area": "计算机科学与技术",
      "degree": "本科",
      "gpa": "3.7/4.0",
      "rank": "15/120",
      "start": "2022-09",
      "end": "2026-06",
      "location": "北京",
      "courses": [
        "数据结构",
        "操作系统",
        "计算机网络",
        "数据库系统",
        "编译原理"
      ],
      "highlights": [
        "连续 3 年校级一等奖学金",
        "校级 ACM 集训队队员"
      ]
    }
  ],
  "work": [
    {
      "organization": "某互联网公司",
      "position": "前端开发实习生",
      "type": "实习",
      "location": "北京",
      "start": "2025-06",
      "end": "2025-09",
      "summary": "负责 XX 中台的通用表单引擎重构。",
      "highlights": [
        "独立完成 30+ 表单场景的 schema 化改造，代码行数下降 45%",
        "引入运行时校验框架，将线上表单类问题下降 60%",
        "沉淀 4 篇技术文档，作为团队 onboarding 材料"
      ]
    }
  ],
  "projects": [
    {
      "name": "MiniReact",
      "role": "独立作者",
      "type": "个人",
      "url": "https://github.com/zhangsan/mini-react",
      "start": "2024-11",
      "end": "2025-02",
      "summary": "从零实现 React 核心机制的教学向仓库",
      "tech": [
        "TypeScript",
        "Rollup"
      ],
      "highlights": [
        "实现 Fiber 架构、Hooks、Concurrent Mode 简化版",
        "编写系列博客共 8 篇，GitHub 累计 500+ star"
      ]
    }
  ],
  "skills": [
    {
      "name": "编程语言",
      "keywords": [
        "TypeScript",
        "JavaScript",
        "Python",
        "Go"
      ]
    },
    {
      "name": "前端框架",
      "keywords": [
        "React",
        "Vue",
        "Next.js"
      ]
    },
    {
      "name": "工程化",
      "keywords": [
        "Webpack",
        "Vite",
        "Rollup",
        "ESLint",
        "Jest"
      ]
    }
  ],
  "awards": [
    {
      "title": "全国大学生数学建模竞赛 · 一等奖",
      "date": "2024-09",
      "awarder": "中国工业与应用数学学会"
    }
  ],
  "languages": [
    {
      "language": "英语",
      "level": "CET-6",
      "score": "580"
    }
  ],
  "custom_sections": [
    {
      "title": "求职意向",
      "items": [
        {
          "heading": "前端工程师 / 全栈工程师",
          "subheading": "意向城市：北京 / 上海 / 杭州",
          "summary": "期望方向：Web 基建、编辑器/低代码、开发者工具"
        }
      ]
    }
  ]
}